{
    "name": "MATH 1110 - Calculus I",
    "crosslisted": [],
    "distributions": [
        "SMR-AS"
    ],
    "seasons_offered": [
        "Fall",
        "Spring",
        "Summer"
    ],
    "credits": 4,
    "grading": "Student option grading",
    "forbidden_overlaps": [
        "MATH 1106",
        "MATH 1110"
    ],
    "forbidden_overlaps_str": "Forbidden Overlap: due to an overlap in content, students will not receive credit for both MATH 1106 and MATH 1110.",
    "prerequisites": [
        "MATH 1101"
    ],
    "prerequisites_str": "Prerequisite: three years of high school mathematics (including trigonometry and logarithms) or a precalculus course (e.g., MATH 1101 ).",
    "remaining_text": "MATH 1110 can serve as a one-semester introduction to calculus or as part of a two-semester sequence in which it is followed by MATH 1120 . For guidance in selecting an appropriate course, please consult First Steps in Math . Staff. Topics include functions and graphs, limits and continuity, differentiation and integration of algebraic, trigonometric, inverse trig, logarithmic, and exponential functions; applications of differentiation, including graphing, max-min problems, tangent line approximation, implicit differentiation, and applications to the sciences; the mean value theorem; and antiderivatives, definite and indefinite integrals, the fundamental theorem of calculus, and the area under a curve.",
    "raw": "MATH 1110 - Calculus I\n(SMR-AS)\nFall, Spring, Summer.  4 credits. Student option grading.\nForbidden Overlap: due to an overlap in content, students will not receive credit for both\nMATH 1106\nand MATH 1110.\nPrerequisite: three years of high school mathematics (including trigonometry and logarithms) or a precalculus course (e.g.,\nMATH 1101\n). MATH 1110 can serve as a one-semester introduction to calculus or as part of a two-semester sequence in which it is followed by\nMATH 1120\n. For guidance in selecting an appropriate course, please consult\nFirst Steps in Math\n.\nStaff.\nTopics include functions and graphs, limits and continuity, differentiation and integration of algebraic, trigonometric, inverse trig, logarithmic, and exponential functions; applications of differentiation, including graphing, max-min problems, tangent line approximation, implicit differentiation, and applications to the sciences; the mean value theorem; and antiderivatives, definite and indefinite integrals, the fundamental theorem of calculus, and the area under a curve.",
    "all_prereqs": [
        "MATH 1101"
    ],
    "prereq_tree": {
        "MATH 1101": {
            "name": "MATH 1101 - Calculus Preparation",
            "crosslisted": [],
            "distributions": [],
            "seasons_offered": [
                "Fall"
            ],
            "credits": 2,
            "grading": "Letter grades only",
            "forbidden_overlaps": [
                "MATH 1101"
            ],
            "forbidden_overlaps_str": "",
            "prerequisites": [],
            "prerequisites_str": "",
            "remaining_text": "Staff. Introduces topics in calculus: limits, rates of change, definition of and techniques for finding derivatives, relative and absolute extrema, and applications. The calculus content of the course is similar to 1/3 of the content covered in MATH 1106 and MATH 1110 . In addition, the course includes a variety of topics of algebra, with emphasis on the development of linear, power, exponential, logarithmic, and trigonometric functions. Because of the strong emphasis on graphing, students will have a better understanding of asymptotic behavior of these functions.",
            "raw": "MATH 1101 - Calculus Preparation\nFall.  2 credits. Letter grades only.\nStaff.\nIntroduces topics in calculus: limits, rates of change, definition of and techniques for finding derivatives, relative and absolute extrema, and applications. The calculus content of the course is similar to 1/3 of the content covered in\nMATH 1106\nand\nMATH 1110\n. In addition, the course includes a variety of topics of algebra, with emphasis on the development of linear, power, exponential, logarithmic, and trigonometric functions. Because of the strong emphasis on graphing, students will have a better understanding of asymptotic behavior of these functions.",
            "all_prereqs": [],
            "prereq_tree": {}
        }
    }
}